Category,Date_and_Time,Keywords,Article
Others,"
May 02, 2014 13:36 IST
","
Rebus 562
","You can follow PGG's Rebus Corner on >twitter or >facebook.
"
Others,"
May 04, 2014 02:26 IST
","
Visually-challenged paraglider flies solo
","On Wednesday afternoon, at Kamshet near Pune, a 36-year-old undertook his first solo paragliding flight. As soon as he landed, his trainers ran out and huddled around him. Amid cheers, one said, “We did it. You made history.”
Divyanshu Ganatra had just become the only visually-challenged Indian paraglider to have flown solo. “It was a spiritual high,” Mr. Ganatra told The Hindu before adding modestly: “I did it like everyone else does.”
A clinical psychologist who lost his sight due to glaucoma at the age of 19, Mr. Ganatra runs a counselling and corporate training organisation called ‘Yellow Brick Road’.
The flight was made possible by Templepilots, a paragliding club run by Avi Malik and his wife Anita Deshpande.
According to Mr. Malik, there are no official records of visually-challenged people having undertaken solo flights. A Master Instructor at the Association of Paragliding Pilots and Instructors, he stated that no other Indian had attempted this before. “There are probably one or two worldwide who have attempted this successfully,” he said. A hearing-impaired Belgian performed the same feat under his guidance last year.
For Mr. Ganatra, however, it wasn’t about the achievement or about proving a point to anyone. “I did it because of my love for the sport,” he said. For Mr. Malik and his wife, taking up his request was an “instinctive decision.” “The heart said yes first, the mind worked on it later,” Mr. Malik said.
What was most important was working together and having faith in each other. “I trusted them with my life. That is the only way I could have done this,” Mr. Ganatra said. Ms. Deshpande agreed. “It was about trust, and not about [never] flying anymore.”
The experience helped Mr. Malik stretch his own boundaries as a teacher as he sought to find new ways and means to guide Mr. Ganatra. “One way was using simulation, and working on other senses: touching, feeling and listening,” he said. To explain the concepts of aerodynamics, Mr. Malik asked Mr. Ganatra to use his hands to understand how the glider works.
In a ‘tandem’ flight with an instructor, he learnt what the experience could be like. An initial idea of using bells was discarded as Mr. Malik thought that audio signals broadcast through a radio would do the job. A quick and instinctive learner, Mr. Ganatra was ready for his flight after three days of on-ground training.
“The experience was an overwhelming mix of joy, fear and excitement. When you are in the sky, you taste freedom,” he said.
"
Others,"
May 02, 2014 21:34 IST
","
The best sheets
","My grandmother always stressed the importance of making the bed well, especially when one has house guests. To this day I love watching her make the bed, she makes it look effortless and the end result is beautiful. The sheets she uses are soft and sweet smelling, and have been collected over the years from trips abroad—good quality bed linen wasn’t always available in India as it is now. The bed linen is freshly laundered and ironed; first to go on the bed is the fitted sheet, a top sheet is then added and the corners folded back neatly and the sides tucked into the mattress, a pillow inserted into a matching case is placed at the head of the bed. When it is cold a blanket is layered over the top sheet. The finishing touch is a pretty counterpane that covers the bed and finally cushions are artfully placed on top.
I recently made a trip to a department store to buy some new bed linen, the number of brands, variety in design and material was astounding. Fitted sheets, pretty duvets, even things like mattress protectors were available.
“People are more open and willing to invest in home décor not just in terms of interior design but also the products and items they use when it comes to bed linens, pillows, bed runners etc,” says Arun Bhawsingka, CEO Creative Portico Pvt Ltd, their brand Portico New York which deals with bed and bath furnishings is available at most department stores. Home décor magazines, television shows and social media has heavily influenced and exposed people to the art of making the bed, “The influence of international trends and many brands now available in the market has created more awareness,” says Akanksha Himatsingka, Director of Atmosphere Furnishings which has stores across the country. “More importantly it is the visual influence of social media platforms such as Pinterest, Instagram, etc, that offer a variety of DIY bed linen ideas, which many are embracing and experimenting with.”
Portico New York prides itself on having bed linen to suit every budget, “We do solids and self-jacquards. We also have theme based designs, which could be teamed with matching comforters and duvets,” says Arun. Portico New York has also had fashion designers like Manish Arora and Neeta Lulla design bed linen for them.
Bed linen is all about personal taste and style, whether you want bright motifs or subtle prints, pastel colours or vibrant tones. “We have a range of solids, stripes and patterns in percale and satin sheets at Atmosphere,” says Akanksha “The products are versatile, most of our sheets can be coordinated with the various designs offered.” This allows you to mix and match bed linen. “We don’t believe in collections and trends. We add new items every year but they all belong to the same world,” says Yamini Namjoshi, Brand Director of Bandit Queen which is an India based luxury home-linen brand that is available around the world. “A lot of detail and time goes into creating our products so we want them to be timeless in design and usage.” Bandit Queen customises bed sheets based on size and if you want to feel truly special they can monogram your initials on the bed linen.
With summer upon us try to keep bed linen cool and light. “Summer bedding should be light and easy, it can be fresh solid colours or interesting multi-coloured stripes in light tones mixed with neutrals,” says Akanksha.
Cottons and linens or even cotton-linen blends work best for the season. Thread count is something we have all heard about when it comes to choosing bed linen. Thread count is basically the number of horizontal and vertical threads that make up one square inch of fabric. So the higher the thread count the softer the sheet feels, but it is important to remember that higher thread count also weakens the fabric.
“Thread count is important to a degree,” says Yamini. “But the more threads you have in one square inch means that the thread used is thinner, which could make the fabric weaker. So there should be a balance between the tactile feeling of the material and durability.”
When it comes to buying bed linen pay attention to quality along with design. Considering the number of hours we spend in bed, the material should be comfortable, feel good and most of all enhance sleep.
Because after a hard day’s work nothing beats the feeling of getting in to a bed made with comfortable sheets that smell of sunshine and forgetting the world outside for a few hours.
Pay attention to the quality of the bed linen
Don’t buy sheets that have a high thread count, the material will be weaker
While buying fitted sheets make sure you know the dimensions of your mattress so that you buy the right size
Change your bed sheets at least once a week
"
Others,"
May 04, 2014 03:02 IST
","
Water-level in Vani Vilas Sagar fast depleting
","Owing to the fast depletion of the water-level at the Vani Vilas Sagar in Hiriyur taluk in the district, there is a possibility that Chitradurga city and Hiriyur taluk could face shortage of drinking water in the coming months.
The Vani Vilas Sagar was constructed across the Vedavati, by the kings of Mysore during the 1890s to provide water for drinking and irrigation in the surrounding areas. The dam, however, has not reached its full capacity in the last nine decades owing to various reasons, including scanty rainfall in the region.
Presently, the water-level in the dam is about 68.5 ft against the full reservoir level of 145 ft, and the dead storage level is 60 ft. Silt accumulationThere is a considerable decrease in the storage capacity of the dam owing to silt accumulation. No steps have been taken to remove silt from the dam since its construction, sources said. The water available in the dam can be supplied for another two months, sources said. Apart from Chitradurga city and Hiriyur taluk, water has to also be supplied to premier institutes such as ISRO, DRDO and India Reserve Battalion as per agreements signed with them.
The authorities have also granted permission for the construction of barrages at some places across the Vedavati in Kallod and check-dams at certain places, which would further reduce the flow of water to the dam. Instead of granting permission for construction of barrages and check-dams, the authorities should first remove silt from the dam as it had considerably affected storage capacity, sources added.
"
Others,"
May 03, 2014 17:43 IST
","
Classically, Zubin
","‘Political Views Test the Harmony’, punned the New York Times’ headline in a  recent Arts-section lead story that ran — with the subhead ‘Conductor of Israel Philharmonic (Orchestra) Speaks His Mind on the Middle East’ — over a frowning photo of a pained-looking Zubin Mehta, eyes closed, baton raised. At 77, Mumbai-born, Vienna-trained Mehta leads the orchestra that is Israel’s premier cultural ambassador.
Hosted by the American Friends of Israel to play at Manhattan’s Carnegie Hall, Mehta gave a lengthy interview to the NYT in which he said, “I speak openly about a country that I see, from my private musician’s perspective, as going in the wrong direction (with) the settlements… They know I’m a friend and being in a democracy, I express my opinions freely.” Courageous words uttered publicly in a city whose powerful Zionist lobby rules its impressive cultural and intellectual worlds; tolerated because Mehta has proven his solidarity with Israel repeatedly. During the Gulf War, he played through the fall of Scud missiles while the audience donned gas masks — and stayed to listen. He played when Hezbollah’s rockets fell and, another time, rescheduled concerts so audiences could get home before the curfew.
The maestro’s association with the IPO harks back to when he was invited, at 25, to substitute for an indisposed conductor. He had never heard of the orchestra founded 25 years earlier, as the ‘Palestine Orchestra’, for talented Jewish musicians who were banned from performing in pre-Nazi Europe. At its inaugural concert in 1936, the legendary Arturo Toscanini, then the highest-paid conductor in the U.S. and a staunchly anti-fascist non-Jew, had volunteered to conduct the opera gratis. Later, the IPO named Mehta its Music Director and, in 1981, Music Director for Life. “That title’s just a handshake, there’s no contract,” Mehta explains. “I’ll stay as long as the players want me.”
Not just the players but all of Israel seems to want Mehta, an unlikely national hero as a Parsi who, despite a cosmopolitan life spent abroad, remains Indian at heart. (Moved, for instance, by hearing of Raj Kapoor’s death before a Moscow concert, Mehta shared the news with the audience and dedicated his performance to the Russians’ beloved superstar.)
As conductor of the redoubtable New York Philharmonic from 1978-1991, Mehta became a celebrity, lionised by the media, darling of socialites. Sexy and glamorous, ‘Zuby baby’ came from the Los Angeles Philharmonic to head the world’s best, most difficult orchestra. He had occasional problems with players and critics though never with audiences who idolised his musicality as much as his dashing stage presence. (Still handsome, Mehta has aged gracefully to embody dignity onstage.) He mentored and promoted young players, took his elite orchestra to Harlem, commissioned Ravi Shankar to compose a sitar concerto that they performed together at the Philharmonic where, on Saturday mornings, he introduced children to classical music. At one such ‘Young People’s Concerts’, he handed over his baton to a 12-year-old to conduct in his place! Visiting Parsis, attending Mehta’s morning rehearsals, would go backstage to be heartily welcomed by “
aapro (our own) Zubin” with jolly conversation and gifts of CDs.
When he declined to renew his contract after 13 years, everyone was disappointed. He left Manhattan’s rat race because “spiritually, it’s necessary to have time to study, to rethink.” He wanted to do “more opera, more touring, things out of my routine.” And he did that: He gained popularity with a universal TV audience by conducting the ‘Three Tenors’; now he heads the opera in Florence, Italy, and tours worldwide. Each year, he spent three months with the IPO. “Israel and its people remind me of India; people are always talking, arguing, laughing,” he observes. “The orchestra — the country itself — is like a warm close-knit family. It’s one of my spiritual homes; I’ve grown up with them, I’ve been there since 1961.”
Musically, too, he’s had serious disagreements with Israeli society: his passion for 19 century German composer Richard Wagner is not reciprocated. As Hitler’s favourite, Wagner is loathed in Israel where survivors still bear Auschwitz’s tattoos. “He was 110 per cent anti-Semitic,” Mehta concedes. “But, he’s half my world.” When the IPO played Wagner for an encore at a 1981 concert, Israelis booed and walked out. Mehta has not dared revisit Wagner, an opera lover’s dream. Still, “the relationship with my favourite orchestra is a lasting marriage” based on a shared devotion to music. When Mehta was honoured by Washington’s Kennedy Center, the IPO flew in from Israel to serenade him! On his — and the IPO’s — 70 birthday, they surprised him by playing “Happy Birthday” at their Carnegie Hall gala.
For years, Mehta has made music education a priority. In Mumbai, he honoured his musician-father by establishing the Mehli Mehta Foundation, which trains 300 children in Western classical music. In Tel Aviv, the Buchmann-Mehta School of Music trains Israeli musicians, while his ‘Mifneh’ programme caters to 250 young Arabs in the West Bank that he often visits. “With my Indian passport, I have no problem. The Indian ambassador in Ramallah sends his car.” Mehta’s dream is to find an Israeli-Arab to play in the IPO. “May be,” he muses, “music will help us come together.”
"
Others,"
May 03, 2014 10:23 IST
","
A tradition kept alive
","Temple festivals not only unite all communities together under a common platform and provide a space for youth to display their talents and courage but also ensure survival of traditional sports.
Double bullock cart race, locally known as ‘rekla’ race, was one such traditional and famous sports held as a part of the annual Chithirai festival of Sri Muthalamman Temple at Thummalapatti near Batlagundu near here. The entire village wore a festive look on Friday and people from Thumallapatti and nearby areas thronged it to witness the festival since morning.
The main road connecting Thummalapatti, Kanavaipatti Sri Lankan refugee camp and Pudhupatti Kamarajapuram was converted into a race track. Traffic was closed on this road.
Spectators converged on both sides of the road to witness the event.
Under big bull category, bullocks owned by Madhu Bala of Cumbum clinched the first prize.
Vairam of Goodalur bagged the second prize. In the mid-size bull segment Sellayi Amman of Vadipatti emerged winner and Sridhar of Goodalur settled with second prize.
In the small size category, known as ‘Karichan Kunju’ segment in the local parlance, bullocks owned by Arivu of Uthukuli emerged winner and bulls of Arunkumar of Chinnamanur got the second prize.
Cash award of Rs.10,000 Rs.7,000 and Rs.6,000 were given to top three winners. Majority of prizes were bagged by bulls from Theni district.
Race organizer Pon. Kuppusamy said that 138 bullock carts from Dindigul, Theni, Madurai, Cumbum, Theni, Chinnamanur, KK Patty, Alanganallur, Iyyampalayam, Natham, Singampunari, Melur, Sholavandhan, Tiruchi and Manaparai participated in the race.
This race will test the agility of bulls and riding tactics of young riders, he added.
Sufficient force was deployed at the village to regulate the crowd.
The bullocks were divided into three categories – big bullocks, mid size bullocks and small size bullocks - on the basis of their size, height and capability to take part in the race. Separate races were conducted for each category.
"
Others,"
May 04, 2014 16:18 IST
","
Former TN Minister held for poll code violation
","Former Tamil Nadu Minister and DMK leader Suba Thangavelan was arrested in Ramanathapuram on Sunday for violating the poll code and under provisions of Motor Vehicles Act while canvassing for party candidate in a convoy of more than 12 vehicles, police said.
Mr. Thangavelan was canvassing for Ramanathapuram DMK candidate Mohamed Jaleel on April 20, 2014 at Kulanur, using a convoy of more than 12 vehicles, they said.
He had not only violated the model code, but the MV Act by going in a big convoy without police permission, police added.
Acting on a complaint from the sub-registrar of cooperatives Dhanapal, seeking action against him, a case was registered against him.
"
Others,"
May 03, 2014 18:02 IST
","
Equal in every way
","On April 15, 2014, India’s Supreme Court took a major step in making India more inclusive and humane, by according legal recognition for the first time to the ‘third’ gender or ‘transgender’ people. The fact that these people do not belong to either the male or female gender should not be used, the highest court directs, to block their entry into educational institutions or employment. The judges went further to classify transgender people as ‘other backward classes’, thereby making them eligible for affirmative reservations in education and public employment.
The significance of this enlightened judgment — in reversing a long history of ‘unspeakable violence’ endured by transgender people since colonial times — is highlighted by a significant report titled ‘Transcending the Binaries: Transgender Exclusions in Law and Policy’ by Shubha Chacko and Arvind Narrain, for the forthcoming India Exclusion Report 2013-14 by the Centre for Equity Studies.
Transgender people, they explain, are people who live fully or partially the gender role ‘opposite’ to their biological sex. They quote Veena, a hijra in Bangalore, who declares, “I am a transgender, a woman, dalit, sex worker, socialist, and poor. I am all these things and much more. And I fight to build up a world where I will be accepted for everything I am.”
But the ambiguous sexuality of transgender people, their refusal to accept the sexual identity imposed on them by biology and birth, has led to a long history of social and official refusal to accept them as equal citizens or human beings. Instead they are treated — often violently — as the ‘other’, what the authors describe as ‘invisible, ridiculous, horrific or disgusting’. They are “often laughed at, shunned, rejected by their families, denied jobs, ration cards and passports, and exploited by others in the professions they are allowed into (for instance, seeking alms and sex work). They repeatedly face a host of problems from institutions as diverse as family to the medical establishment including the arms of the state, particularly the police. The social and cultural practice of discrimination coupled with poverty, illiteracy and limited opportunities of employment have led to increased vulnerability of these communities.”
The report highlights the many ways that both criminal and civil law in India have criminalised and legally withheld elementary rights from transgender people. The authors trace the contemporary criminalisation of transgender people to the 1897 amendment to the Criminal Tribes Act of 1871, sub-titled ‘An Act for the Registration of Criminal Tribes and Eunuchs’. Under this statute, a eunuch was ‘deemed to include all members of the male sex who admit themselves, or on medical inspection clearly appear, to be impotent.’ Any eunuch who appeared ‘dressed or ornamented like a woman in a public street….or who dances or plays music or takes part in any public exhibition, in a public street….[could] be arrested without warrant and punished with imprisonment of up to two years or with a fine or both.’ A eunuch was considered incapable of acting as guardian, making a gift, drawing up a will or adopting a son. Although this ‘law stands repealed today in theory’, Chacko and Narrain find that it ‘continues to exist as part of the living culture of law’.
There is the infamous Section 377 of the IPC which makes punishable ‘unnatural offences’ of voluntary and consenting sexual intercourse which goes ‘against the order of nature’. The Immoral Trafficking Prevention Act 1896 has been amended to be gender neutral and, in theory, does not criminalise sex work; but by making soliciting and running brothels illegal, sex workers are continuously vulnerable. The report finds that transgender sex workers tend to be arrested on charges of stealing and extortion rather than for sex work. Apart from sex work, the only other profession that society permits transgender people to enter is begging, but anti-begging laws, another colonial legacy, are used to arrest and detain transgender people who solicit alms for a living.
Chacko and Narrain also show how sexual non-conformity is used to bar access of transgender people to many civil rights, even though they in theory enjoy the same fundamental rights as people who accept the sexual identities that biology has assigned them. Prior to this historic judgement of India’s Supreme Court, “The Indian state’s policy of recognising only two sexes and refusing to recognise hijras as women, or as a third sex (if a hijra wants it), has deprived them, at a stroke, of several rights that Indian citizens take for granted. These rights include the right to vote, the right to own property, the right to marry, the right to claim a formal identity through a passport and a ration card, a driver’s license, the right to education, employment, health so on. Such deprivation secludes hijras from the very fabric of Indian civil society.”
Transgender people are excluded both by state and society. They are not protected by the state when raped, they are only offenders. Shubha Chacko explains that the state does not even count them, because they do not count. They trouble us so much because they force us to question body and desire; and their existence challenges — even subverts — patriarchy, which celebrates masculinity, while here is a group that rejects their biologically-given manhood. And it is a very lonely community. However oppressed you are, say as a dalit or a Muslim, at least you have your family to fall back on. But not transgender people. They have only people ‘like them’ to fall back on, no one else.
The progressive — even if greatly belated — judgment of the Supreme Court will not change overnight the destinies of people who do not conform to the sexual practices of the majority of the population. But it reminds us of the unacceptable ways that our society and law treat people of difference — with contempt, injustice and violence. It will hopefully pave the way for a more humane and inclusive world for people who may or may not be like you or me, but that in no way makes them less human.
"
Others,"
May 02, 2014 23:43 IST
","
Former minister’s son held on murder charge
","CHANDARLAPADU (KRISHNA DT.): Police on Friday arrested Vasantha Krishna Prasad, son of former Home Minister, Vasantha Nageswara Rao, in a murder case.
In June last year, one Podili Ravi was murdered in the district and Mr. Krishna Prasad had been facing conspiracy charges in that case.
Speaking to The Hindu on Friday, Nandigama Deputy Superintendent of Police (DSP) D. Chinna Hussain said following the statement given by Ravi’s wife, Madhavi in the court alleging Krishna Prasad as a conspirator in the murder case, police arrested the accused.
“We arrested Krishna Prasad under Sections 302 and 307 of IPC. He was produced in court and remanded to judicial custody in Nandigama Sub-Jail,” said the DSP.
Meanwhile, leaders of Telugu Desam party staged a protest against the arrest of Krishna Prasad.
//EOM.1300 hrs.
"
Others,Date_and_Time,Keywords,Article
