Category,Date_and_Time,Keywords,Article
Entertainment,"
July 28, 2018 16:16 IST
","
Is Bollywood scared of Dalit love?
","In a country where only 5.82% of the population marries outside the community, the very idea of inter-caste marriage and choosing one’s life partner is fantasy. But it is fantasy and desire that are the two key ingredients of commercial Indian cinema. Not surprising then that a big production house like Dharma Productions grabbed the opportunity to remake the Marathi blockbuster Sairat,  which dealt with the theme of exogamy. The just-released Dhadak is Bollywood’s adaptation of Nagraj Manjule’s Marathi tale of a tragic romance between a Dalit boy and an upper-caste girl. 
Dhadak is the second mainstream Hindi film this year after Anurag Kashyap’s Mukkabaazto showcase inter-caste romance. So, are there winds of change sweeping through commercial cinema with major production houses daringly taking on the hot-button issue of caste? 
The answer is complicated. In Dhadak, for instance, the caste identities of the lead characters are different from those in Sairat. The hero, Madhukar Bhagla (Ishaan Khatter), is the only son of a lakeside restaurant owner, and the heroine, Parthavi Singh (Janhvi Kapoor), is the daughter of a renowned politician in Udaipur. 
It’s evident from their surnames that the young man and woman in Dhadak are both from the sacred-thread wearing upper castes. So, in Dhadak, the romance might be inter-caste but, unlike Sairat, both people are from privileged upper castes.
The other inter-caste romance of the year, Mukkabaaz, was also an upper-caste romance — Rajput boy and Brahmin girl.
Much bolder 
Unlike the mainstream films, in sharp contrast are some small productions that dared to centre the story on Dalit protagonists. Neeraj Ghaywan’s Masaan (2015) traced the lives of a Dalit boy and an upper-caste girl, both grieving the loss of their partners. The film ends beautifully on a promising note: the two find themselves on the banks of the Ganges in Allahabad and take a boat ride to the sangam. The ending is both optimistic and fantastical, all we see is the glimmer of a possible romance.
I explored two exogamous relationships in my film Chauranga (2016). One, which plays out as a fantasy, was between a Dalit boy and an upper-caste girl. The boy dreams of her, adores her, enjoys the sight of her but never approaches her. The day he writes her a letter, it turns his world upside down.




The second exogamous affair is shown as a possibility. The upper-caste man and the Dalit woman meet and mate in a cowshed, outside the confines of his upper-caste household. This realised fantasy meets a tragic end when the man accidentally kills her fearing the loss of his honour.
In fantasy
In Sairat, Manjule shows us in vivid detail how the love story of an upper-caste girl and a Dalit boy plays out in life. It looks like any other love story that breaks the ever-present societal barriers of caste and class, but the consequences of such transgressions soon become clear. 
Manjule’s first feature film Fandry also toyed with the idea of inter-caste romance. But it operated purely in the fantasy realm where a Dalit boy silently adores an upper-caste girl and never musters the courage to approach her. When he finally does, his caste and livelihood of rearing pigs is thrown in his face to show him his place.
The realisation of exogamy in Masaan, Chauranga and Sairat unmistakably involved migration to the city. In Sairat, the couple escapes a caste-ridden rural society to seek jobs and a possible future in urban factories. 
In Masaan, the boy and the girl migrate from a puritan Varanasi to Allahabad, the city of confluence. Interestingly, the girl finds a job in the railways and the boy is hired as a civil engineer, both professions distinct symbols of modernity. In Chauranga, the lone Dalit survivor boards a goods train carrying coal to save his life. The coal, train and migrant labourer, all three are necessary ingredients of modernity.
Unlike these smaller films that boldly dealt with caste and inter-caste relationships, the bigger Hindi films restrict their flings with caste to upper-caste romances alone. Clearly, their interest lies in only capitalising on the fantasy of inter-caste marriage and steering clear of the actual issue — the status of Dalits and their relationship with upper castes. Is Bollywood too scared to portray a Dalit love story?
The writer-director made the award-winning film Chauranga. @bikas
"
Entertainment,"
July 28, 2018 12:25 IST
","
YouTube to go up against Netflix and Amazon with original content for India and other markets
"," Alphabet Inc's YouTube is creating scripted series and other original programming for international markets including France, Germany, Japan, Mexico and India to try to draw new customers to its paid subscription service, a senior executive said on Friday.
The programming will come in the form of multiple genres such as music documentaries, reality series, talk shows and scripted series, Susanne Daniels, YouTube's global head of original programming, said in an interview. It will be produced in local languages and subtitled or dubbed for other markets.
Some of the programming will appear on YouTube Premium, the monthly subscription service formerly called YouTube Red. Other content will be available on YouTube's free service with advertising.
“We are targeting markets where we believe we have a tremendous upside in potential subscribers,” Ms. Daniels said.
YouTube already has released a handful of original shows in South Korea and one in India, a talk show in Hindi about cricket. Called UnCricket, the show has performed “beyond expectations,” Ms. Daniels said.
Ms. Daniels also said a reality show starring South Korean pop band Big Bang had boosted subscriptions, and that 50% of the new customers came from outside of Korea.
More details about the new international slate will be released in the coming weeks, she said.
YouTube will be competing with companies including Netflix Inc and Amazon.com Inc that are investing in local language programming for online audiences around the world.
The first original shows from YouTube debuted on its premium service in 2016, starting with series from some of the platform's most popular video creators. It added programming from Hollywood stars and also released a batch of children's shows including Emmy-winning Fruit Ninja Frenzy Force.
There are no current plans for more original children's programming, Ms. Daniels said. The YouTube Kids app serves that younger audience, she said, and the company does not believe children's content will drive subscriptions to YouTube Premium at this time.
"
Entertainment,"
July 29, 2018 20:54 IST
","
In Star Wars virtual reality,you get to be the hero
","Imagine putting on a helmet, lowering the visor and being transported immediately from your humdrum day-to-day existence into your own Star Wars adventure.
The kind of fantasy that could once only be woven into the dreams of the young is coming to a theme park or shopping mall near you — perhaps sooner than you think.
The Void is the latest in a flood of businesses offering whole-body, fully immersive virtual reality experiences for about double the price of a movie ticket.
The company's Star Wars: Secrets of the Empire scenario instructs players that their mission is to recover Imperial intelligence critical to the survival of the Rebellion — yes, that Rebellion, of Luke Skywalker and Princess Leia.
In reality, the players are in a room full of cameras, movement sensors and other gadgetry in the shadow of Disneyland in southern California.
As far as they are concerned, they are rebels disguised as Imperial stormtroopers on the molten planet of Mustafar, battling giant lava monsters and generally taking care of business.
Wearing vests weighed down by high-tech hardware, the players can reach out and touch what they are seeing in their visors, feel the breeze on their faces and hear creatures scuttling around them. 
Designed in partnership with Disney-owned Lucasfilm, which makes the Star Wars movies, the experience involves all the senses, says marketing director John Kirkpatrick. “I really felt like I was in the movie,” says player Sean Oshima, 29, a technology consultant. 
“I was really amazed by this technology. You can really feel the agents shooting you.”
Cusp of a boom 
The experience — typically enjoyed in groups — costs about $30-35 for 10 minutes, and gets about 500 visitors a day in Anaheim. 
There are locations in North America, the Middle East and Europe and the company is still growing, with other scenarios including a narrative tour around the movie “Ghostbusters,” and a haunted house experience. 
"
Entertainment,"
July 30, 2018 15:20 IST
","
Classic comebacks in gaming
"," Legendary game developers Capcom, brought us the Street Fighter 30th Anniversary Collection recently. Plus Okami HD is scheduled for release next month and we have been hearing whispers of a Devil May Cry collection. Now they have brought us a new collection with their classic character Mega Man, bundling all his past games into a two-part legacy collection.
Mega Man X Legacy Collection 1 and 2




What’s it about?


Along with names like Mario and Sonic, has always been Mega Man, a thinking and feeling android created by Dr Light. Mega Man X marked an evolution of the character in 1993, bringing into the spotlight the character design we now know and love, making that iconic blue suit edgier with a gun arm. The X series débuted on the SNES and rose to fame. This is where the Legacy Collection 1 drops you. You start off playing the first four games, which are the best the series has to offer.
Legacy Collection 2 is where the nostalgia sort of peters off, as you play X5 to X8, mostly due to the inclusion of the not-so-good X7. The worst part of the collection though, is the splitting of it into two parts. Street Fighter 30th Anniversary Collection packed in 12 games into one bundle, why couldn’t they do the same with the Legacy Collection?
How does it play?
If you loved Contra in the arcades or on your old home machines, you will love Mega Man X. It’s a side-scrolling platformer, with a lot of bullet hell elements that make this a fantastic game. Playing X1 to X8, you can see the evolution of the series, as they pack in a lot more characters, storylines and gameplay elements into the mix, to make things fresh. Especially the evolution of the art style and the technology of that time, as the bits evolved from 16 to 32 and so forth.
Capcom has included a lot of fun stuff in the package. Mega Man X is a tough game and they have a Rookie Hunter Mode that lets you breeze through and experience the levels and story. This is especially great if you want a hard dose of nostalgia without going through the challenge. Undoubtedly, this is best played on the Nintendo Switch, as the game seems to be perfect for the plucky handheld. Whatever the console, be prepared for a lot of repetitive stress disorder from mashing the fire button in the first few Mega Man X games, which lack rapid fire.
Should you get it?
If you’re a fan of Contra and other side-scrolling games, you can indulge yourself in this collection, though first buy either the individual games or the first part of the collection to see if it’s your cup of tea.
With all the gaming giants showing off the same old, same old, No Man’s Sky stood out because it offered us something so vastly different. After a long and troubled development, No Man’s Sky launched in August 2016, with all the fanfare of a broken record — riddled with bugs, with no multi-player. While it still had the generated worlds, the game was almost unplayable. Fast-forward two years and the developers have kept at it, fixing the game slowly. To mark their launch on the Xbox One, Hello Games released a game-changer of a patch codenamed Next, which completely redefines the game. This is not just a patch, it’s a second-coming.
No Man’s Sky Next




What’s it about? 


Hello Games didn’t just dream a game, they dreamed an entire universe. That wasn’t all; it was a universe that would take you millions of years to discover yourself. They took their procedurally generated dream and wowed us collectively at every E3. The very thought of a program that created entire worlds filled with creatures, flora and fauna that were completely unique. Where you, along with millions of players across the globe, can discover together. That was No Man’s Sky.
That was not all. No Man’s Sky was inspired by the cover artwork of great science-fiction writers Isaac Asimov, Arthur C Clarke and Robert Heinlein. Adding that secret sauce made the game all the more compelling. While the launch did not go well for No Man’s Sky, the vision was there, everything looked beautiful. You could lose yourself in this game. Except, it just was not quite baked as yet. The spirit was and is still undeniably there, as players uncovered secrets and communities built bases and colonised those digital stars, while Sean Murray and his team at Hello Games got things right. Which they did in their next patch.
How does it play? 
“This is an important next step on our journey,” their patch notes open with. If you’ve been disappointed with No Man’s Sky in the past, think of Next as the first step. This is the game they wanted to build, this is the game that dropped our jaws, this is the game I fell in love with. 
In addition to the improvements in the graphics department, there are better base-building options and weekly challenges to keep things fresh. There is better multi-player too, and while you still can’t see players floating about, you can invite your friends over to your freighter to complete missions, dogfights or just discover and colonise new planets together. The feeling of jumping into your spaceship, accelerating towards the stars, each one of them a planet waiting for you to discover, is unparalleled.
Should you get it? 
If you have been turned off by the negative reviews of No Man’s Sky till now, you can ignore it. At this very moment, people are actively changing their Steam ratings to reflect this new patch, giving the game a fighting chance. Everything deserves a second chance and No Man’s Sky is high up on that list.
The writer is a tech and gaming enthusiast who hopes to one day finish his sci-fi novel
"
Entertainment,"
July 30, 2018 10:35 IST
","
‘Stranger Things’ season three delayed: Netflix ","Fans of Stranger Things will have to wait longer for the third season of the popular sci-fi series, Netflix has confirmed.
Cindy Holland, programming executive of the streaming giant, revealed that the show will not arrive till next summer, but has reassured that the next spell will be “better” than the second season.
Season two, which premiered on October 27 last year, received mixed responses from the fans.
“It’s a handcrafted show. The Duffer Brothers and Shawn Levy, they understand the stakes are high. They want to deliver something bigger and better than last year. I think it’s going to be a fantastic season. It will be worth the wait,” Holland said.
According to EW, she was in a conversation with the critics at the Television Critics Association’s press tour in Beverly Hills.
Holland also noted that the next season will have more special effects than the previous ones.
“It’s a really exciting season, just takes a little more time,” she said.
The show has already released a teaser trailer for the next season.
 

"
Entertainment,"
August 02, 2018 22:33 IST
","
Netflix to feature 'Baahubali' prequel
","Fans of Baahubali can revisit the world of Mahishmati in a new Netflix series that will explore the journey of the character of Sivagami, in a prequel to S.S. Rajamouli’s two-part blockbuster.
The series, which was announced by Netflix on Thursday, has already been given a two-season order.
Baahubali: Before the Beginning is based on Anand Neelakantan’s book, The Rise of Sivagami.
Season one of the series will have nine episodes and captures Sivagami’s journey from a rebellious girl to a wise queen. Netflix has teamed up with the team behind Baahubali, including Arka Media Works and Mr. Rajamouli. Deva Katta and Praveen Sataru will co-direct the series.
Mr. Rajamouli said, “I am very excited that this is being adapted as a Netflix Original Series. With Netflix as our partner, we have the opportunity to create a rich and riveting series and take this quintessential Indian epic to the world, which is very gratifying to me as a storyteller.”
According to a synopsis provided by the streaming giant, “Power, politics and intrigue find themselves juxtaposed against the rise of Mahishmati — from being a city-state to an empire.”
Erik Barmack, vice-president, International Originals, Netflix, said, “Baahubali is a world-class franchise that epitomizes the power of compelling stories that resonate globally.The series is a tremendous opportunity for us to give audiences more of the universe that they have come to love, and welcome millions more into the global Baahubali fandom.”
"
Entertainment,"
August 03, 2018 18:02 IST
","
Kalki Koechlin’s Indian life
"," Sometime in 2017, Bollywood actor Kalki Koechlin received an email from Jon Manel of the BBC’s World Service. He asked if she would be interested in hosting a podcast focussed exclusively on Indian stories. Koechlin took more than six months to accept, thanks to her busy schedule. But she is glad she did. The culmination of months of research and hours of recording launches today, with the first episode of Kalki Presents: My Indian Life. With 10 episodes featuring as many guests (each clocking in at over 20 minutes) — Koechlin emphasises that the series is a collection of “compelling, personal stories about being young and Indian”.
In the pilot, we hear the chiming bells of Delhi-based belly dancer Eshan Hilal’s hip chain. Drawn to dancing at a young age, Hilal describes how he was physically beaten by his father even as he continued to practise the art form. There was mounting family pressure to stop. “I felt like a defective piece by God,” he recounts sombrely, going on to speak with Koechlin about how he stood his ground and stayed committed to dance as a profession.
Everyday stories
“These people are very much relevant to the changes that India has faced in the last 20 years,” explains Koechlin, about the podcast’s focus on young subjects. “Forward-thinking people from different fields doing things that we never expected.” Another episode features an ice hockey player from Ladakh, who recounts the story of how she and her team would spend an entire night pouring water into an enclosed space so that they would have an ice rink to practise on the next day. The topics covered in the series range from sexual abuse to caste-based prejudice to family discrimination.




Koechlin, whose own French heritage and upbringing in Auroville makes for a fascinating story about the different shades of India, is grateful for the podcast because it has helped her escape the social media echo chamber. “It really opened up my views. The kind of things I listen to are still very much connected to the people that I know. I am learning a lot,” she introspects.
While she opens with the lines, “If you are young and Indian, this is your podcast,” the actor believes that the stories will find resonance with non-local audiences, too. “These are human emotions that are universal,” she explains. “We have focussed on understanding what’s going on in India, but the problems described are not purely Indian.”
With the backing of a global media house and a spotlight on India’s diversity, My Indian Life stands to provide incredible insight into complex stories, similar to what Rukmini Callimachi’s The Caliphate, or series three of Malcom Gladwell’s Revisionist History, have achieved. Yet, the pilot disappoints. It feels clinical, with Koechlin’s studio voice booming in over live-sound recordings, translating an intimate conversation between Hilal and his mother from Hindustani to English. The host does not feel connected to the subject.
Exploring platforms
Koechlin has a well-established reputation for working across mediums. With a wide list of theatrical productions already under her belt, the actor, who was recently appointed Chevalier de Ordre des Arts et des Lettres, has embraced the podcast because of the anonymity it offers. “A person feels a lot less conscious talking into a recorder than being on video,” she explains. “It can get very intimate because you’re not feeling conscious of yourself. It’s an incredible medium in terms of just being able to listen to a person.” 
There is also the convenience of listening to a podcast, she points out. “I listen to them in the morning when I’m doing other things, and I find that (the information) seeps in without you noticing,” she says. Her current favourites are IVM’s The Pragati Podcast, as well as the occasional French podcast that her mother shares with her.
Koechlin, who recently completed filming for Zoya Akhtar’s upcoming film, Gully Boy, will also be seen in Amazon Prime’s upcoming web series, Made in Heaven. As for season two of My Indian Life, she says pensively, “I hope so.”
"
Entertainment,"
August 03, 2018 17:57 IST
","
Murr in the house
"," Some might argue that James Murray has the best life — he spends all his time with his best friends, and plays pranks on them for a living. He travels the world with them, playing stages like the O2 Arena, Radio City Music Hall and Madison Square Garden. Currently, they are touring the US, and have just wrapped up the filming of season eight of their cult hit show, Impractical Jokers. Somewhere in the middle of all this, he has found time to co-author Awakened, a supernatural novel, with Darren Wearmouth. 
What Murray is looking forward to, however, is his first ever trip to India later this year. “We get more fan mail from India than from America, the UK, Australia and Italy combined. It’s unbelievable,” he exclaims. On the phone, he sounds exactly like he does on the show — hyperactive and always ready to laugh. Yesterday, he was on Comedy Central’s Facebook page for a live session, where hundreds of fans tuned in to ask him questions about his interests, advice on love and how he keeps the friendship with fellow jokers — Joe Gatto, Sal Vulcano and Brian Quinn — ticking. 


He will also be picking the line-up for Sunday’s marathon of the show on TV. Any other person would pick what shows them in a good light. Not Murray, though. “It will be 20 episodes, featuring some of my most embarrassing, and favourite, moments,” he says with his signature chuckle. Although the four comics have sizeable online followings, they have not been creating online content as frequently as they used to when they started out. But their approach to the medium is similar to how they put together their show, he says, explaining, “The show is just my best friends and I being ourselves. We don’t play a persona. And so for the web, we now prefer to do live video interactions over sketches, where our fans can see the real us.”
While tour dates and locations have not been announced yet for his solo visit to the sub-continent, Murray says, “I’ll be throwing a big party for our fans, where I can get to meet and interact with them in an informal setting. It will also be a chance for me to introduce my book to them.” 
"
