Category,Date_and_Time,Keywords,Article
Others,"
May 02, 2014 01:46 IST
","
Seven killed in two road accidents
","Seven persons were killed in different road accidents in Bagalkot and Raichur districts on Thursday.
Four persons died and two others were grievously injured when their SUV rammed a stationary lorry on NH 50 near Hosur Cross in Bagalkot taluk.
The police identified the dead as Shantakumar, Niranjankumar, Mohammad Pasha Shaikh, and Murtujsab Dodmani. The two injured were shifted to a private hospital in Bagalkot. The police said the victims were working in a mining company in Sandur taluk of Bellary district.
The police said the accident occurred when the victims were returning to Sandur after attending a wedding at Sindagi town in Bijapur district. The Bagalkot Rural police station has registered the case.
Three of the five persons travelling in a car were killed when their vehicle collided with a lorry at a blind curve near Valmiki Math at Golapalli village on Lingsugur-Hutti road on Thursday.
The dead have been identified as Husainsab Naganur, Raju Lakshman Pawar, and Lakshman Kendhuli of Ilkal town in Bagalkot district. The other two who were critically injured and admitted to Lingsugur government hospital are Sourabh and Jagannath.
“It is learnt that they were musicians and were going to give a performance in Gulbarga when their car collided with the lorry,” Mr. Murali said. Husainsab was a well-known singer of Dasara kritis.
“Apparently, it was the carelessness of the car driver that led to the accident,” M.N. Nagaraj, Superintendent of Police, told this correspondent after visiting the spot.
A case has been registered.
"
Others,"
May 03, 2014 17:47 IST
","
Prison diaries
","On December 22, 2012, Chetan Mahajan reached Bokaro to reason with angry parents of students enrolled in Everonn, the Chennai-based IIT coaching chain. Mahajan had been with the company for just three months. The Bokaro branch of Everonn had begun losing teachers to other institutes that paid a higher salary. Increasingly uneasy, the parents of enrolled students demanded a refund; rumours that the company was shutting down only served to compound the problem.
Mahajan, in Bokaro for what he thought would be a meeting with parents, found himself arrested and jailed. Mahajan spent the next month in Bokaro’s prison. From that experience came Mahajan’s first book, Bad Boys of Bokaro Jail (Penguin), an account of both his prison days and an inside view of the state of Indian prison and justice system. “I always wanted to write, but didn’t know that this would become my impetus,” he says. Completely blind-sided, Mahajan initially expected to be out of jail within days, even hours. “I wasn’t legally liable for what had happened. I hadn’t cheated the parents or taken their money. I was only an employee and I thought the whole thing would clear up soon. It didn’t sink in till I actually found myself being taken to the jail.”
Incarcerated in an under-trial jail, Mahajan met and interacted with people he never thought he’d meet. The book begins with a series of text messages he exchanged before and during the initial procedure that led to his arrest. “I changed my phone recently, but my old phone had all the messages stored, and I wanted to include them.” The frantic worried tone of the messages underline Mahajan’s growing panic that day.
The feeling only worsened in jail, with his phone, laptop and other means of communication taken away. “For the first few days, I didn’t know what to do. I was afraid and confused.” He adds that he remembers the watershed moment when he chose to write his experiences down. “I knew that to survive inside, I’d have to turn this negative, crushing experience into something positive.” On his brother’s next visit, Mahajan asked him for supplies — notebook, pens, to begin documenting his life in prison.
In the acknowledgement, Mahajan thanks the students and the Jharkhand police, admitting that he looks at what happened to him as a sort of blessing in disguise. “I am a different person because of this experience. I look at people differently. I am kinder, more accepting, more understanding of poverty and hardship. I understand that everyone deserves a second chance, and this chance can change their lives.”
Mahajan encountered many different people during his incarceration. Some became friends whom he has returned to the prison to visit. “That place is very familiar now. And some people I wanted to go back and keep in touch with. I want to know what’s happening to them.” Mahajan has changed names to protect identities. “I can’t protect the jailer’s identity, whose sympathy I was grateful for, but there were certain prisoners who helped me in ways that, if their names were revealed, would land them in trouble.”
Mahajan describes the illegal but expertly constructed ways in which prisoners survive the harsh environment, with everything from cell phones to cigarettes coming at an absurdly inflated price.
For his family, “this is more than a book. This is a window into my life and what happened to me when I was separated from them. Each one of my family and friends tell me that they’ve read it in a single sitting.” Mahajan hopes that his book will strike a similar chord with readers too. “Initially, after my release, I was barely functional. I was asocial and had nightmares. It took me very long to snap out of it.”
A lot has changed for Mahajan and he has shed the bitterness and anger. “I was angrier with my employer than with the justice system. It was them I expected help from, but it was too late coming.” In that one month, Mahajan did not once face a judge. His comparatively short stay in an under-trial prison became an example of a much bigger problem facing the country: life as it is for the crores of under-trial prisoners in Indian jails.
While Mahajan doesn’t plan to change the course of his career — education being his chosen path — he wants to help change and improve the lives of those inside prisons. “If there are groups working towards this goal, I’ll be more than happy to do my part.”
"
Others,"
May 02, 2014 21:34 IST
","
Down to earth
","These wriggling, weak-looking worms hardly trigger respect on sight. But looks can be deceiving, and these down-to-earth worms could actually hold the key to reinstating soil vitality. That is because earthworms eat huge volumes of leaf and all kinds of organic litter (as much as three to five times their body weight, every single day) and cast out nutrients that are easily absorbed by plants. In fact, vermicompost (organic wastes composted by earthworms and associated organisms is considered to be the most nutritious of all manures), while vermiwash (water run through columns of organic matter and cow dung composted by earthworm and microbial activity) has been found to promote plant growth, thanks to the presence of the plant growth hormone IAA in vermiwash. Earthworms also secrete a slimy fluid that contains nitrogen, a plant nutrient. And in the process of burrowing, earthworms mix up the top soil with the bottom soil which distributes manure and moisture throughout the soil. The burrowing action also aerates the soil, which is crucial for plants’ growth.
In conversation with us is Dr. Sultan Ismail, international expert on earthworms. This Chennai-based soil biologist, ecologist and founder of Ecoscience Research Foundation is the one who first coined the term vermitech, the technology for composting organic wastes using earthworms. ""Earthworms are the pulse of the soil. The more earthworms there are in the soil, the healthier is the soil,"" says Dr. Ismail. Here is how we can welcome earthworms into our gardens and potted plants. For more, check out www.erfindia.org

What earthworms can we introduce in our garden or potted plants?

Local worms are recommended rather than imported worms because local worms burrow better and are more adapted to survive in our soil. I recommend Perionyx excavatus (surface dwellers) and Lampito mauritii (subsurface burrowers). A mix of surface and subsurface worms is ideal.

Where can we obtain earthworms?

You can collect earthworms from your neighbourhood. One can also contact the local agricultural department, municipalities, and nurseries of the forest departments, and select horticulture shops for earthworms. Alternatively, you can use cow dung sold in cow sheds. This cow dung will have eggs of local worms. Acquire this cow dung in a semi-dry condition, neither as fresh cow dung nor as dry cakes.

How can the soil be readied to sustain earthworms?

Keep mulching the soil. Don’t clear away the fallen leaf litter. This mulch layer is crucial and will protect the soil’s moisture and beneficial microbes and attract earthworms. Keep the soil moist but not waterlogged. For this, sprinkling of water once a day will do. Native trees attract worms, so plant native trees rather than exotic species. Remove construction debris from the soil. And don’t spray synthetic pesticides. This kills earth worms.

What is the food that has to be supplied for these earthworms in the soil?

Besides naturally falling leaf litter, you could add semi-composted kitchen waste to the soil occasionally and mix it with the soil lightly. Soon worms will multiply and arrive at an ideal sustainable number.

Can earthworms spread any disease?

Earthworms do not cause any plant disease. They don’t spread any plant infection, unless the infection is already present in the vicinity. And they are absolutely harmless to human beings. In fact, earthworms are used in Siddha medicine.

Can we introduce earthworms to soil in pots?

Yes, but keep watch and remove a few worms, in case they become too numerous for the soil and loosen the soil. Dead earthworms needn’t be removed. They decompose fast and become part of the soil.

Will earthworms crawl into our houses from soil in potted plants/gardens?

Earthworms prefer to stay close to soil with food source and moisture.

Earthworm trivia

Earthworms can grow back segments or parts of their body that get severed!
Common earthworms are just a few centimetres long, but the the Giant Gippsland Earthworm found in Australia reaches a length of 4 metres.
Earthworms are hermaphrodites, have both sex organs within the same individual.
So fascinating are earthworms that the grand old man of evolution, Sir Charles Darwin studied earthworms for over 44 years and put up his observations in his book ‘The Formation of Vegetable Mould Through the Action of Worms, with Observations on Their Habits’, which instantly became a best seller.
"
Others,"
May 04, 2014 17:57 IST
","
I am… Manjunath – School resource person
","I am passionate about working with children. But before I discovered my love for children, I worked in Canara Bank and took voluntary retirement in 2001. I started pursuing my hobbies which had taken a backseat earlier. So from sitting behind counters, it was off to following my passions like cricket, theatre, music, reading, trekking and other adventure activities.
After a couple of years I started working with my wife in a school as a parent volunteer. That’s when my bond with children began. We did theatre, sports and other games and activities for children in schools. Then we also started working on science by using waste material and making toys as well as teaching children to do simple experiments. That was also when my sister-in-law started an organisation which had a branch called Balavihar that reached out to schools, including government, aided and unaided, that lacked certain facilities. We realised that some of them did not even have a library. So we started creating libraries, which later led to the building of our mobile library. This opened a whole new world of books for children. Then we tied up with an NGO called Asha For Education. This opened doors for us to reach out to schools with theatre and other cultural activities. We teach yoga, music, theatre and so on.
During one of these sessions, a parent from a well-known Montessori school saw my work and I was invited as a resource person. There began my journey independently, sans the group. Once a week, I work with Balavihaar and the rest of the week I visit schools like Creative, Magic Puddles and Namma Shaale. Since I am a voracious reader, story telling too became a part of my repertoire.
My work with children led to extensive theatre and voice exercises, exposure to the lives of people like Gandhiji, Einstein, Galileo and to know our own states like the heritage of the Cauvery river, History of India, the British Raj among others. When it comes to performing a play, I allow the children to take the lead in deciding the roles they want to perform as through the training they recognise their own strengths and weaknesses.
It’s a fulfilling and a challenging job, which is like a workout… painful while you are at it, but the end result is brilliant.
"
Others,"
May 03, 2014 02:37 IST
","
SC rejects plea seeking action against police
","The Supreme Court on Friday rejected a contempt petition filed by an advocate against the Kerala police for not registering an FIR against the Mata Amritanandamayi Math after a former inmate wrote a book alleging sexual abuse at the math.
A Bench of Justices Ranjan Gogoi and Madan B. Lokur dismissed the plea after K.K. Venugopal, appearing for Kerala, submitted that no cognisance could be taken on the basis of statements made in the book (
Holy Hel
l).
In his contempt petition, Deepak Prakash alleged that the “rape” happened in a religious place and the victim was a foreign national. He said he had lodged a complaint with the police after the victim sent him a mail corroborating the averments in the book for registration of an FIR. Mr. Prakash said the Karunagappally police on February 26 refused to register an FIR. He said he forwarded the complaint to the Police Commissioner and the DGP for immediate action.
He said: “Unfortunately, because of political pressure, till date, no action has been taken. This amounts to collapse of law and order and violation of the apex court judgment in the Lalita Kumar case, in which the court mandated registration of FIR on receipt of complaint.” The petitioner said the police was duty-bound to register an FIR and investigate the matter.
The petitioner wanted the apex court to initiate contempt proceedings against Justin John, SHO, Karunagappally police station, Kollam; Debesh Kumar Behera, Kollam Police Commissioner; DGP K.S. Balasubramaian, and Principal Home Secretary L. Radhakrishnan.
Mr. Prakash said: “It is true that she has revealed her bad experience through her book and even after 15 years, the revelations amount to a clear case of rape in captivity. When the media asked her about the delay, the victim had said that it took years for her to overcome the mental trauma and write a book on the ordeal . Moreover, the Indian judicial system takes many years to complete the legal procedures.”
"
Others,"
May 02, 2014 12:08 IST
","
Master plan drawn up to upgrade Adumalleshwar mini-zoo
","Based on the instructions of the Central Zoo Authority of India (CZAI), district Forest Department officials submitted a master plan to upgrade the Adumalleshwar mini-zoo in Chitradurga district.
The plans, estimated to cost Rs. 2 crore, include expanding the cages, creating walking paths as well as a separate play area for children.
The master plan was submitted two months ago and work will begin once the CZAI gives approval.
The sources said that every year, the department received a revenue of Rs. 4 lakh owing to the large number of visitors. After the zoo was upgraded, the entry fee would also be revised and the department would start getting more revenue, they added.
According to official sources, CZAI officials visited the Adumalleshwar mini-zoo in May 2012 and expressed their dissatisfaction over the facilities. They also criticised the lack of play area and walking space. They instructed the Forest Department officials to prepare a master plan to upgrade the zoo by utilising 25 acres of land. At present, the zoo is located on 10 acres of land. The officials had also set certain norms pertaining to the size of the cages, separate space for canteen, walking path and play area. As per their directions, a team of officials, led by the District Forest Conservator Kumarswamy , visited the Mysore zoo to conduct a detailed study of the facilities there.
According to sources, the officials interacted with the Mysore zoo authorities to prepare a master plan that would ensure that the animals in the mini-zoo were provided with better facilities.
"
Others,"
May 02, 2014 10:54 IST
","
Security beefed up at railway stations in Madurai division
","Security and vigil have been beefed up at all railway stations in Madurai division following twin blasts at Chennai Central Railway Station on Thursday morning.
The Railway Protection Force and Tamil Nadu Railway Police have put in additional security measures. All the passengers are being frisked and their luggage scanned at Madurai junction.
“We have posted more men all around the railway premises, both in uniform and civvies, to monitor the movement of suspicious people. All the 68 closed circuit television (CCTV) cameras installed at Madurai junction are in working condition. An additional staff is monitoring the footages,” G. Selvaraj, Assistant Commissioner, RPF, Madurai, said.
Officials said all the empty rakes of trains were being piloted to the station and coaches were checked with sniffer dogs. The parcels too were scanned at the parcel office.
The security agencies conducted a combing operation on the station premises on Thursday. Meanwhile, a travel bag kept hidden underneath the stairs at the parcel office created flutter around noon. The security officials heaved a sigh of relief when they found only clothes inside. The officials suspect that the bag was lifted by some thief and later abandoned.
"
Others,"
May 04, 2014 13:20 IST
","
Coastal tourism to get a boost
","Several beaches in Karnataka are set to get a facelift with the Union government approving Rs. 45-crore phase one of a project to develop tourism in ‘Coastal Karnataka Tourism Circuit’.
This is one of the four circuits identified in Karnataka for tourism development.
In Dakshina Kannada district, beaches at Uchila, Someshwar, Ullal, Tannirbavi, Panambur and Surathkal are likely to be taken up for development apart from some islands. They will get facilities such as approach roads, toilets, and watchtowers, according to sources in the Tourism Department.
While Director of Karnataka Tourism G. Satyavathi confirmed that the Centre has approved the Rs. 45-crore project, official sources said this was only the first instalment of the bigger project envisaging expenditure of about Rs. 500 crore to develop more than 140 beaches. In the next three years, about Rs. 150 crore is expected to be spent, with bulk of it coming from the Union government.
Though the plan was to provide cottages along the beeches, there is no government land outside the Coastal Regulation Zone (200 m away from the high tide line) in Dakshina Kannada. The department, however, hopes to encourage private players to build cottages for tourists.

Four circuits identified

A study conducted by Infrastructure Leasing & Financial Services Ltd. for the government of India’s Tourism Department has identified four circuits for development in Karnataka. One of them, the Coastal Karnataka Tourism Circuit, comprises destinations in Dakshina Kannada, Udupi, and Uttara Kannada districts along the coastline extending up to Goa.
The study said, “Based on the carrying capacity assessment, tourism potential, and discussion with the Department of Tourism, Karnataka, the Circuit 1 (coastal tourism) … has been proposed as the priority circuit.” It listed Mangalore’s good connectivity with domestic and international destinations via air, rail and road network as a key advantage. It said tourism destinations in the three districts have good connectivity with Mangalore, with NHAI having taken up the project to upgrade the national highway from Talapady to Kundapur into a four-lane road.

Key positives

Significant tourist inflows, diversity and quality of tourism assets in terms of beaches, scenic destinations, backwaters, wildlife sanctuaries and adventure tourism, and historical monuments were other key positives for the circuit.
The poor state of approach roads, and lack of drinking water facility, parking, food and beverages outlets, quality wayside amenities and public conveniences on the way to some of the tourism destinations were mentioned as weaknesses.
But the coastline circuit had significant potential for development of beach tourism, “given that Karnataka shares the same coastline with Goa and Kerala”, the study concluded.
"
Others,"
May 02, 2014 23:04 IST
","
An adventure sport that children love
","This summer, let your child have loads of fun by experiencing something different at LEPL Icon Multiplex on Ring Road. Imagine the joy of the child when he walks, crawls or even rolls down in a transparent colourful ball floating on water.
Zorbing, the adventurous sport which originated in New Zealand, is a reality in city now. Since the water sport concept is new here, a large number of schoolchildren, with their parents in tow, throng this multiplex in the evening hours to facilitate their wards to play inside the ball.
Even while the kids are making the best of the opportunity, their parents capture their ecstatic moments inside the zorbing ball by clicking pictures.
“There is an overwhelming response to the new addition. Close to 400 children play and enjoy the sport every month,” says K. Mohan Murali, Manager of the SVM Gaming Centre at Icon. He says the turnout increases in the weekends when families visit the multiplex either for shopping or for watching a movie.
“The game involves rolling down in a large plastic ball known as ‘Zorb’ made up of transparent plastic. The rider is “trapped” inside the transparent inflatable ball, which rolls down. It floats on water while the rider uses ball’s momentum to direct it,” he says, pointing to the ball placed in a 16X16 feet tub filled with 3-feet-deep water to enable the zorb float easily.
“We are taking necessary precautions before a child can get inside the ball,” Mr. Murali says, adding that children aged between five and 15 years are allowed to play. A fee of Rs. 50 is charged per head. “My kids enjoy it thoroughly as it is a new game introduced recently,” says a happy parent.
"
Others,"
May 04, 2014 13:30 IST
","
Experts to inspect injured wild elephant
","The Forest Department will submit a formal reply to the Kerala High Court on Tuesday on the health condition of the injured female wild elephant that is staying put in waters of the Idamalayar reservoir for the past 25 days.
The department will also inform the court on the action taken during the past 25 days to treat and feed the elephant and also the action planned to save the elephant from its agony. In this connection an expert team comprising veterinarians, wildlife experts and forest officials will diagnose the condition of the elephant on Sunday.
The High Court intervened in the issue following a petition from Daya, an NGO. The animal is being tended to on daily basis by Forest Department officials attached to the Idamalayar Forest Range office. The elephant which is unable to forage is being fed with fruits and palm fronds which it readily accepts from the forest officials.
Chief Wildlife Warden, G. Harikumar, told The Hindu that preliminary diagnosis of the elephant showed that it has a serious injury in its left foreleg. The leg is badly swollen and it is limping heavily. He said that it is not clear why the elephant chose to take refuge in the waters of the reservoir.
But the animal keeps standing in the water most of the time and occasionally comes out of it for short breaks. Mr. Harikumar said that the health condition of the animal has appreciably improved compared to the condition in which it was first found. It has now got used to the forest officials who arrive there regularly to provide food.
The officials have to travel more than one km in a boat from the dam site to reach the location where the elephant stands. Initially on prescription from a veterinary official, some oral medication was administered by concealing it in pineapples given as food to the elephant.
But it was later withdrawn since it was suspected that the animal was allergic to the medicines.
Animal rescue experts said that the elephant standing continuously in water can create other health problems. But rescuing and relocating the elephant from the site where it presently stands will be a herculean task.
The location is such that it will be difficult to bring in cranes or other such equipment. But the Forest Department is doing its best to ensure the well-being of the injured animal, Mr. Harikumar said.
The course of action to be taken will be based on the report to be submitted by the expert committee after its visit on Sunday, he said.
It was Adivasis of the area who first found the elephant in the reservoir.
On noticing that it was injured, they informed the Edamalayar Range Forest officials about it. Adivasis told The Hindu that as they did not see any external injuries, they suspect dislocation or fracture of the affected forelimb.
"
