Category,Date_and_Time,Keywords,Article
Others,"
May 06, 2014 00:03 IST
","
Techie attacked for opposing encroachment
","While the traffic police are encouraging the public to take pictures of traffic offenders and post them on their website as part of their ‘Public Eye’ initiative, a 32-year-old woman software engineer, who tried to do just that, was allegedly assaulted publicly.
But MICO Layout police are yet to take action against the alleged attacker, while the traffic police have promised to act on her complaint against encroachment of a footpath by a car showroom.
The complainant, Shanthala Patil, works in an IT company on Bannerghatta Road. She said she was returning home from work and walking towards Sagar Apollo hospital junction on April 30 when she noticed that the footpath has been encroached upon by the car showroom, forcing pedestrians to walk on the busy road.
When she questioned the showroom staff, they promised to remove the cars. Ms. Patil waited for some time to see if they would remove the cars, but they did not.
Ms. Patil, who was aware of the ‘Public Eye’ initiative, began taking photographs of the encroachment.
Seeing this, one of the showroom’s employees confronted her. The argument between the two took an ugly turn with the employee allegedly trying to snatch the complainant’s mobile phone. He slapped and kicked her when she resisted, the complainant has alleged.
Ms. Patil called her husband and later the police. Some policemen arrived and tried to persuade the two parties to settle the issue amicably, instead of filing a complaint.
Ms. Patil insisted on registering a case of assault against the showroom’s staff and demanded an investigation. Eventually, a complaint was registered with the MICO Layout police.
Personnel at the police station described the incident as a trivial one and said that action would be taken after Sunday as they had to make security arrangements for the IPL cricket match at the Chinnaswamy stadium.
Additional Commissioner of Police B. Dayanand said that he was aware of the incident and would instruct the jurisdictional traffic police to clear the footpath of encroachment at the earliest.
"
Others,"
May 02, 2014 00:41 IST
","
Bringing them to justice
","What happens to the election-related cases registered by the police in the city, now that the crucial part of campaign and polling is over?
The question assumes significance in the backdrop of police claims of cracking down on attempts to lure voters with money, liquor or gifts. The seizure of Rs.90 lakh from a person travelling on an APSRTC bus at Bollarum led to the arrest of the TDP nominee from Peddapally Assembly constituency.
K. Kamala, wife of former Minister K. Parthasarathy, who is the YSRC nominee from Machilipatnam Lok Sabha seat, was arrested a few days after Rs.45.10 lakh was seized from her while she was travelling on a bus at Vanasthalipuram. Criminal cases were registered in both instances, but the investigation is yet to be completed and charge-sheets filed.
In another instance, the Cyberabad police seized Rs.8.32 crore at Palamakula near Shamshabad from two persons believed to be agents of ‘hawala’ operators.
The police top brass maintained the possibility of politicians securing this to influence the ongoing elections cannot be ruled out.
Though crores of rupees were seized during police inspections at different places in the city, these cases attracted the attention of the public as prima facie evidence was found against politicians in the first two cases. Police suspect the role of politicians in the third case too.
Investigators invoked provisions of the Representation of People’s Act and the Indian Penal Code related to the bribing of voters, but connecting the accused with the alleged crime is the crucial task.
On the day of polling too, police slapped charges against some contestants on cases that include slapping the activist of a rival party, obstructing a police officer on duty from discharging their duty, and threatening polling agents.
How many of these cases will be taken to their logical end is to be seen.

Taking diversion could prove dangerous

Regular weekend checks by traffic police have come to deter people from drink-driving. Fines and jail terms for those who test positive during a breathalyser test, are making people stay away from the wheel after a drink. This has also controlled rash driving on the city’s roads and resulted in less number of accidents.
However, many drivers are now familiar with the timings and points where the traffic police look out for drink-drivers. Some have also been giving police the slip by finding newer routes.
“The main roads are not the only routes where accidents take place. Deaths from road accidents on internal roads of residential colonies and other areas are also high,” say voices from the public.
Surprise checks with breathalysers would surely rein in those drink-drivers running riot on the city’s internal roads or distant localities, they say. Proposals to intensify checks involving local law and order police were also mooted.
For some inexplicable reasons, the idea was shelved. Of the over 1,600 persons getting killed in road accidents in and around city, some are reported on routes where the traffic police had never conducted the weekend special drives.
Change in the timings and routes of the drivers would surely help in further controlling the accidents and saving lives, say many.
"
Others,"
May 03, 2014 09:47 IST
","
Police request Facebook, Twitter to block Amrita-Digvijaya photographs
","The Delhi Police Crime Branch has sent an official request to social networking sites Facebook and Twitter asking them to block the circulation of intimate photographs of journalist Amrita Rai and Congress leader Digvijaya Singh.
The development comes a day after a case was registered against unknown persons for hacking into Ms. Rai’s e-mail account.
According to the police, Ms. Rai had requested them to block the circulation of the photographs as it was harming her reputation.
She also told them that she was being threatened through these pictures.
“Ms. Rai had filed a complaint on Thursday evening. We have registered a case under Section 66 of the IT Act and 509 of the Indian Penal Code against unidentified persons. We sent an official request to social networking sites on Friday to provide us with information about the origins and Internet Protocol addresses from where the photographs were being circulated. We have also asked them to block further circulation of the photographs,” said a police officer.
Talking about developments in the case, the officer said it was too early to determine the identities of persons involved or the motive behind circulating the photographs.
“The headquarters of these social media sites are based abroad and it takes time for them to respond or provide information. Our Cyber Cell has already begun investigations and we hope to find the source IP address soon,” said an officer.
Ms. Rai had also tweeted that someone had hacked into her e-mail account.
“My email/computer been hacked & contents tampered with. It is a serious crime in India and encroachment of my privacy. I strongly condemn it [sic].”
The officer revealed that Ms. Rai had in her complaint alleged that the hackers had created a fake Twitter handle in her name and that she was being harassed through abusive tweets. She also gave the police a list of Twitter handles from which she was receiving abusive comments and tweets.
Officers probing the case have not ruled out physical tampering of her laptop either.
“There is a chance that her laptop was tampered with physically, but as of now we think it was hacked through a wireless Internet facility,” the officer added.
"
Others,"
May 03, 2014 03:00 IST
","
Chennai blasts probe: CCTV image provides first clue
","In a find that could help crack the mystery behind the May Day twin blasts in a train at the Chennai Central railway station, the State police on Friday released the CCTV footage of a man running on the platform soon after the train’s arrival.
The Crime-Branch CID, investigating the blasts on board the Bangalore-Guwahati Express that killed a woman passenger and injured 14, disclosed here that the explosives planted in the train were similar to those used to trigger multiple blasts in Patna hours before the BJP’s prime ministerial candidate, Narendra Modi, was to address an ‘Hunkar rally’ on October 28, 2013.
The police’s announcement came after experts from the National Security Guards (NSG) inspected the scene and the materials seized from the damaged coaches.
Inspector-General of Police Mahesh Kumar Agarwal said remnants of clock pieces, batteries, metal pellets and a metallic pipe suggested that a timer device was used as the trigger. Releasing the footage, he said the “person’s movements were unusual and required verification.”
Crime Branch officials also confirmed that the train was running 90 minutes late and had it been on time, the bombs would have gone off after the train entered Andhra Pradesh. Mr. Modi addressed election rallies at five places in the neighbouring State on May 1, including Nellore, close to the Tamil Nadu border.
Any information on the man in the footage could be passed on to the CB-CID on (044) 2250 2500/10 or (0)77086 54202, he said. The man apparently got off the S-3 coach and ran away after the train arrived; we have not seen him getting into the train again,” Mr. Agarwal said.
He said the investigation so far had not indicated any link between the blasts and Zakir Hussain, a Sri Lankan national arrested by the State police three days ago.
Senior officials of the CB-CID rushed to Bangalore following a tip-off.
"
Others,"
May 02, 2014 01:34 IST
","
M.S. Pattabhiraman passes away
","M.S. Pattabhiraman (90), former vice-president of the Music Academy, passed away on Thursday afternoon.
Apart from his involvement with Carnatic music promotion in the Music Academy, he was an active Rotarian and supporter of social and religious causes and Chairman of the Kedarampatti Swamy Trust in Kancheepuram.
He is survived by daughter Tara Murali and two sons, Ramesh Pattabhiraman and P. Vasanthkumar. The last rites and cremation were performed on Thursday evening at Mylapore.
Narada Gana Sabha secretary R. Krishnaswami recalled Mr. Pattabhiraman’s association with the Sabha in the 1960s. “He was a supporter of good causes and during his two terms as a committee member of the Narada Gana Sabha in our infant stages, he was very supportive,” he said.
Veena maestro and Vice-Chancellor of Tamil Nadu Music and Fine Arts University E. Gayathri said that Mr. Pattabhiraman was a very fine gentleman and both Ms. Sulochna, his wife, and he were connoisseurs of music and art. “Though he held a very senior position in the Academy, he would not show it. I always regarded him in a special light,” she said.
Renowned Bharathanatyam artist and guru Sudharani Raghupathy recalled that Mr. Pattabhiraman was a great soul and loveable person.
“Inspite of his age, he would take the trouble to appreciate artists, including the very young ones. Usually people are very stingy with kind words, but he was a man who had a kind word for everyone,” she said.
"
Others,"
May 03, 2014 18:50 IST
","
FIR against Beni for objectionable remarks on Modi
","An FIR was registered against Union Minister Beni Prasad Verma on Saturday for violating the Model Code of Conduct by making “objectionable” remarks about Narendra Modi.
“The FIR was registered against Verma at Chhapia police station this morning for violating Model Code of Conduct by making objectionable remarks against Modi,” District Magistrate Vikas Gothalwal said.
“A person, who discriminates between Hindu and Muslim in this country and creates hatred between them, is not a human being, but a monster,” the Congress leader had said addressing an election rally in Maskanwa town on Friday night.
“Modi must tell whether he is a human being or not. On the massacre of the people in Gujarat you (Modi) say that it’s a reaction. You tease Muslims by stating that even if a puppy comes under you vehicle you feel sad,” he said.
The EC had, two days ago, censured Beni for his “insulting” remarks against Modi and warned that further violation could result in a ban on his campaign activity.
Beni said a person like Modi is an “enemy” of the country and democracy. “If such a person comes to power then self respect of 85 per cent downtrodden people of the country will end and dominance of handful persons will prevail in the society,” he alleged.
On April 8, another FIR was registered against Beni in Balrampur for calling BJP prime ministerial candidate the “biggest goonda” of RSS and that the party’s national president Rajnath Singh his “slave.”
"
Others,"
May 02, 2014 16:29 IST
","
Making her presence felt
","Amidst the glitzy green carpet bombing, Indian International Film Academy took time to breath and introspect about some real issues in Tampa. And what better way to reflect than raising the concern for education of the girl child. IIFA screened the Indian episode of Girl Rising, the evocative documentary by Richard E Robbins. Written by Sooni Taraporevala and narrated by Priyanka Chopra, it tells the story of Rukhsana, the daughter of a daily wage labourer in Kolkata, who draws strength from her father’s will to educate her against all odds. He sacrifices his basic needs so that his daughter could dream and Robbins blends those colourful dreams with the stench of cruel reality around Rukhsana with amazing dexterity. In the discussion that followed, Priyanka and Shabana Azmi reflected on how they drew from their parents to become people who care about the world they live in. “As a child I used to travel with my doctor parents in the villages around Bareilly to distribute free medicine to people who could not afford it. I was very particular about the number of tablets to be given,” Priyanka reminisced.
Priyanka said the girl child should not be considered as a burden and Shabana pointed out human development index is more important than GDP of a country and empowerment of women is a crucial factor in it. “During the course of my visits as UNICEF ambassador I come across girls who complain that that they are discriminated against their brothers in terms of education and even quality of food,” said Priyanka. The actress, who spent some years in Boston as a student, was quick to point out that Indian families in the US are no different when it comes to the girl child. “It was often said that girls have to be saved from the Western influence and hence they should go to the nearby school while boys were free to studies in universities outside the home state. Also the more you forbid the kid to do something, the more he or she would like to indulge in it and the chances to flounder increase. I am not recommending late night parties but when you are living in a society you cannot block the cultural influence. I found this fear strange and stifling.”
Shabana Azmi who runs Mijwan Welfare Society said that gender discrimination was deep rooted and insidious. “You just have to take a look at the books prescribed in the school curriculum. Most of them have two questions: Where is your mother? And the answer would be: She is in the kitchen. Then, where is your father? And the answer would be: He is in the office. I raised this issue in the Parliament that why it can’t be the other way or at least the answers could both are in kitchen and both are in office.”
For Priyanka the catalyst of change came one Janmashtami night. “I know it sounds filmy but it is true. We found a baby girl abandoned beneath my mother’s car. She brought her home and nursed her. For me she became my younger sister. I would take out the clothes of my younger brother and dress her up. And I cried when she was sent to an orphanage. It opened the world to me and I realised all girls are not as privileged as I am.” She pointed out that it was her upbringing that kept her reminding that she had to give back to the society when she was in position of strength.
For Shabana the moment to reflect came when she did Mahesh Bhatt’s Arth. “I grew up in a communist household. We had a hand to mouth existence but gender equality was a given. My mother used to work when my poet father was not earning much. It was when I did Arth and played a character who says no to her philandering husband even after he says sorry that I realised how big a step it is. First the distributors said the ending won’t work because it is too much for an Indian man to say sorry and still not accepted by the woman. Anyway, the film got released and did good business but soon I started getting letters from women who were facing trouble in their married life. The last thing I wanted was to become an agony aunt but I felt that the film has proved to be a sort of catharsis for middle class women who are yet distinguish between a character and a real person.”
She said at Mijwan she has been able to ensure that no girl below the age of 18 gets married. “We often think that we are too small to make change. But it doesn’t take much to ask the maid at home whether her daughter is going to school or not and if she is facing a problem on can come forward to help her out.”
"
Others,"
May 03, 2014 10:49 IST
","
Assam violence: Nine more bodies recovered in Baksa district
","Nine more bodies were recovered from a village in Baksa district on Saturday morning, taking the toll to 32 in the violence unleashed by >NDFB-Songbijit militants in Bodoland Territorial Administration Districts (BTADC) area in Assam.
The bodies of the victims, including four children and two women, were recovered from Khagrabari village under Salbari sub-division adjacent to the Manas National Park, official sources said.
Bodies of two children were identified as Ilina Khatun and Ariful Islam.
Three children, aged between seven and ten years, who were hiding in a forest on the banks of river Beki were also rescued, the sources said.
Besides Chirang and parts of Dhubri districts, >indefinite curfew has also been imposed in Kokrajhar and Baksa districts where 23 people were killed.
The Army has been staging flag marches in the >violence-hit areas to instil confidence among people and to bring the situation under control, the sources said.
The violence started when heavily armed NDFB-S militants entered a house and shot dead three members of a family, including two women, and injured an infant of a minority community near Ananda Bazar area in Baksa district on Thursday.
This was followed by indiscriminate firing by the insurgents at Balapara-I village in neighbouring Kokrajhar district in the early hours on Friday which left eight persons dead and injuring several others in their own houses.
Last night, 12 bullet-riddled bodies, including those of five women and a child, were recovered from Nankekhadrabari and Nayanguri villages in Baksa district where nearly 100 houses and a wooden bridge were set ablaze by the ultras.
Meanwhile, police fired in the air at Basbari in Baksa district when a mob armed with spears and sticks tried to set ablaze a Forest Range office on Saturday morning.
The agitators complained that their houses had been burnt down by militants and government had failed to protect their lives and property, official sources said.
A total of 22 people have so far been arrested in connection with the violence.
Additional Director General of Police (Law and Order) A.P. Rout told reporters that investigation had revealed involvement of NDFB(S) in the violence.
Six of the ten companies of paramilitary forces sent by the Centre to tackle the situation have reached Assam with three of them sent to Kokrajhar and two to Baksa, Mr. Rout said.
Another company was on way to Udalguri district under BTAD as a preventive measure, he said.

>On operations by Army to control the situation, the ADGP said counter-insurgency operations by the troops were on for a long time, but now extra forces ad been posted there in view of the current situation.
"
Others,"
May 02, 2014 01:34 IST
","
Gunmen attacks scribe in Kokrajhar
","Unidentified gunmen attacked the Kokrajhar district correspondent of a Guwahati-based Assamese daily Dainik Janasadharan Dhananjoy Nath and hit him on his head with the butt of a pistol in lower Assam’s Kokrajhar town on Thursday.
Mr Nath, who is also the Secretary of Kokrajhar Press Club, sustained injuries on his head and was treated at a private hospital of the town. The incident took place when he was returning home.
Superintendent of PoliceKokrajhar district, Sunil Kumar told The Hindu that Mr. Nath had told the police that the attackers had hit him on his head with the butt of a pistol.
The SP said that police suspected that it could be a case of extortion as Mr. Nath owned a hardware shop and suspected militants had probably attacked him in a bid to extort money from him. He said that investigation into the incident had already begun and the details were expected to be known in a day or two.
"
Others,"
May 04, 2014 19:20 IST
","
Two North Eastern Railway officials booked for bribery
","The Central Bureau of Investigation has registered a case against a Chief Administrative Officer and a Chief Engineer (construction) with the North Eastern Railway besides six private persons, including the chief editor of a small-time Mumbai magazine, for allegedly receiving bribes in lieu of a contract worth Rs.58 crore.
The contract was for the construction of three rail over-bridges between Maharajganj and Masrakh in the North Eastern Railway Zone in Bihar. “Searches have been conducted at 12 locations on the residential and office premises of the accused senior Railway officials and the other accused persons in Gorakhpur (Uttar Pradesh), Chhapra (Bihar) and Mumbai,” said a CBI official.
According to the agency, the two accused Railway officials are Chief Administrative Officer Omkar Singh and Chief Engineer Sanjay Kumar Mishra. The magazine editor has been identified as Suresh Tripathi.
“During the searches, we seized Rs.15 lakh in cash and jewellery worth Rs.50 lakh from Mr. Mishra’s residence,” said the official. The CBI teams have also seized cash, jewellery and details of bank account, fixed deposits and properties from other places. “Certain documents allegedly relating to the transfer and posting of Railway officials and award of contracts were also seized from the premises of a private person,” said the official, adding that some of the accused are contractors.
"
Others,"
May 03, 2014 14:43 IST
","
03rd May 2014
","Mrs. V. INDIRA (76), Wife of Mr. V. Srinivasa Rao, Chennai-600089, expired on 01-05-2014. Eyes donated to Rajan Eye Bank, (Project of Rotary Club of Madras, T.Nagar), Chennai-17. (Ph: 28340500).
Mr. G.J. Rathinasamy, B.S (U.S.A), S/o. Mr. S.C. Jayaraj Nadar passed away on 02.05.2014. 58, Vaigai Street, Velmurugan Nagar, Bypass Road, Madurai. Prayer Meeting at 5.30 P.M on 04.05.2014. Mobile: 94422-49940 / 94426-49940.
Mrs. Thangam, W/o. late Mr. S. Venkateswaran (Southern Railway) passed away on 30.04.2014. Dasasthu on 09.05.2014 . 4th Cross Street, Lakshmi Nagar Extn., Porur, Chennai. Phone: 044-2476 3227.
Mr. N.S. Ravichandran passed away on 02.05.2014. Funeral on 04.05.2014. Vanavil, #11, Ormes Road, 3rd Cross Street, Kilpauk, Chennai – 600 010.
Mrs. R. Jayalakshmi passed away on 29.04.2014. Mobile: 94449-91389.
Mrs. V. Indira Srinivasa Rao, W/o. Mr. V. Srinivasa Rao (Retd. CGM, NLC Ltd) passed away on 01.05.2014.
Mr. S.K. Sarma, Retd. General Manager (Engg) Civil, Airports Authority of India passed away on 27.04.2014. Dasasthu on 05.05.2014 at 10 A.M at : 5/340, Madipakkam Main Road, Madipakkam, Chennai – 600 091. Phone: 044-4202 0147 / Mobile: 0-98400-24720.
Cdr. N.I. Rajagopalan, Retd (Native of Aranipatti, Pudukkottai) passed away on 02.05.2014 at Chennai.
Mrs. Seetha Chidambaram, W/o. late Mr. M. Chidambaram (D.E. Highways – Retd) passed away on 01.05.2014. Mobile: 99628-94745.
"
