Category,Date_and_Time,Keywords,Article
Entertainment,"
December 06, 2018 10:02 IST
","
Cardi B to separate from rapper husband Offset ","Rapper Cardi B announced on December 5 that she is seeking a divorce from her husband Offset after just over a year of marriage, saying “I guess we just grew out of love.”
In an Instagram video, the “Bodak Yellow” singer, one of the biggest names in the music industry this year, said although she and Offset were good friends and business partners, “things just havent been working out between us for a long time.”
Cardi B, 26, and Offset, 26, a member of rap trio Migos, married secretly in September 2017 and had a child in July.
“Its nobody fault. I guess we just grew out of love but we are not together anymore. I dont know. It might take time to get a divorce and I'm going to always have a lot of love for him because he is my daughters father,” she said.
She captioned the video, “There you go ... peace and love.” Offset responded to her Instagram post with the comment, ”Y'all won.”
Cardi B has reached success in the past year with hit singles “I Like It,” “Girls Like You,” with Maroon 5, and the Bruno Mars collaboration “Finesse.”
The singer's brand of female empowerment and sexuality won three American Music Awards and three MTV Video Music awards earlier this year. She is expected to figure highly in Grammy nominations to be announced on December 7.
"
Entertainment,"
May 01, 2014 18:58 IST
","
Sans logic or humour
","“Tuck your brains away. Don’t look for logic. Enjoy this full length comedy play.” This was the announcement just before Sowmya’s play, ‘Oodha Colour Ribbon,’ began. The play is written by Chithra Ram and directed by T.V. Radhakrishnan. The play was part of Kartik Fine Arts’ Kodai Nataka Vizha.
Looked like the audience implicitly obeyed those words for there was hardly a sound heard throughout. Of course, many tiptoed out of the hall while the play was in progress, disillusioned by the stale jokes.
It is time playwrights stopped depicting lawyers, constables and auditors in poor light. There are other ways to highlight the sense of humour in them. The dialogue here was just babble.
Addle-brained hero Madhavan with protruding teeth was an insult to Kamal Hassan’s ‘Kalyanaraman.’ Jeyasurya as Senior Advocate Varadachari was the only saving grace.
Every time the hero’s friend Ajith (T. Rajendran) had to deliver a lengthy dialogue, he turned towards the audience and said his bit in a stand-at-ease position. Sure enough, it had the audience in splits.
Now for the plot... Madhavan (P.T. Ramesh), a lawyer, joins Varadachari’s office and falls in love with a junior lawyer, without realising that she is his senior’s daughter. He plans a kidnap drama with help from his friends.
Veteran Karur Rangaraj, convicted because of Varadachari, escapes from jail with the intention of kidnapping his daughter. The friends, meanwhile, kidnap Varadachari’s wife. The captives are taken to the same place and both parties demand a heavy ransom from the senior lawyer. These scenes remind you of the film ‘Ullaththai Alli Thaa.’
The actors are to be sympathised with for being saddled with such a sloppy script.
Looks like the writer and the director themselves followed the announcement to a T. For, the play had neither style nor substance.
At Naradha Gana Sabha, 7 p.m.
May 2: Enna Kavi Paadinalum
May 3: Kalyana Vaelaiyil Karadi
May 4: Saalaiyora Pookkal
May 5: Vaibogamae
"
Entertainment,"
May 01, 2014 18:42 IST
","
Replaced by a Robot
","The problems faced by aging parents, who are left to fend for themselves by their U.S.-settled wards, were highlighted in Chennai Navabharath’s ‘Oru Robovin Diary.’
The play was staged as part of Kartik Fine Arts’ Kodai nataka VIzha.
Veteran actor Koothabiran was the anchor, who lived the role of Nataraja Iyer. He capitalised on his real age to execute his role with ease. The sag at times seemed inevitable.
Natarajan’s son Ramkumar (Vignesh Ratnam), daughter-in-law Charukesi (Anuradha Ganesh) and grandson are about to return to the U.S. after their vacation in Chennai. Nataraja Iyer is unable to bear the separation and pleads with his son to stay back, something he has been doing for the past 22 years.
Ramkumar, a software engineer, designs a robot which is programmed to carry out his father’s every command. And the machine does it --- preparing coffee, administering medicines or playing songs, it does anything and everything. Ramkumar assures his father that it will make good his absence.
The director N. Rathnam’s effort to enact part of the robot, was praiseworthy. Nowhere did he flounder, either in his mannerism or in dialogue delivery. Rathnam, who takes credit for the story and dialogue as well, packed the scenes with a fair amount of melodrama.
Vignesh Ratnam, as somebody torn between the lure of material comforts and the love for his father, exhibited appropriate expressions. For instance, his anguish when he is informed about the pink slip waiting for him in the U.S. Anuradha Ganesh as the nagging wife, was convincing. T.P. Sreeram as the wise family doctor, who advises Ramkumar about relationships, N. Ganesan as the cook and R. Venkatraghavan as Ramkumar’s greedy father-in-law, did justice to their roles.
Incisive dialogue pepped up the play. Background score by Sanjana and Nikhil had a right mix of peppy tunes and melancholic phrases, and helped. However, one felt making use of the veena, flute and the sitar would have lifted the emotional scenes to greater heights.
"
Entertainment,"
May 01, 2014 18:38 IST
","
Summer potpourri
","Lines that highlight the quaintness of the lingo of a particular section of society may add a flavour, but they cannot serve as the foundation of a play.
In Arangan Arangam’s ‘2BHK’ (story, dialogue and direction Srirangam Rangamani), the focus seemed to be on the peculiarities of the Iyengar lingo, with content playing second fiddle. It seemed as if the writer was focussed on what unique Iyengar terms he could include, and had then built a story around it. As a result, food was a major component in the dialogue, perhaps just to include typical Iyengar words such as ‘akkaravadisal’ and ‘satramudhu.’ The story meandered, and it wasn’t clear if it was about a house, or about wedding expenses. It also had regressive observations, for example- “A girl belongs to her husband’s family, head to toe,” and “A middle class man must never have a girl child.”
The process, where the prospective groom and in-laws meet the girl, was portrayed in such an old fashioned way that one wondered which period the story was set in. The idea of a sponsored wedding is old hat. In 2008, Venkat did an entire play centred round that notion and even gave it the title, ‘Sponsored Kalyanam.’ Why did Sangeetha as Vaidehi always call her mother in an annoyingly whining tone? There was nothing to shore up the proceedings, which stretched to 140 minutes.
Stage Creations came up with ‘Appa, Appappa..’, by S.L. Naanu. Sivaraman (Kathadi) is a retired man, who is convinced that his family is disrespectful towards him. Even innocuous statements are seen as slights by this hypersensitive senior citizen. He decides that the only way to get his family to respect him, is for him to ‘disappear’ for some time, the premise being that absence will make their hearts grow fonder. So he runs away from home. The play was billed as a comedy, but it wasn’t all that funny. There was, of course, the ‘Kathadi’ factor in operation, so that every time he appeared on stage, there were laughs and claps. But strip that away for a dispassionate look and you will realise that the comic element was not that strong. ‘Running away’ is not new to Kathadi, something he did in his 1970s play, ‘Runaway Husband.’ That was a hilarious play. The ‘runaway Appa’ of 2014 didn’t quite measure up. Mocking those with Hansen’s disease was insensitive and objectionable.
“Oh! What a tangled web we weave, when first we practise to deceive!” It’s a tangled web indeed, which Raghav (Sriram) weaves in Dummies’ ‘Sugamana Poigal’. Egged on by his friend Mohan (Prasanna Sridharan), Raghav gets Ramasamy (R. Giridharan) to take the place of his father. The deception is necessitated by the threat of suspension, which Raghav faces in his college. Afraid that Raghav’s tomfoolery may jeopardise his career, Ramasamy sets him right. Raghav shows his gratitude to Ramasamy in a unique way. Prema Sadasivam as the college professor was a bit over the top, though it was not entirely her fault. The lines written for her made her sound schoolmarmish. Since there is an impersonation, there are the usual mix ups.
Sreevathson, who has written and directed the play, made good use of the potential for humour in these situations. Comedy based on such mix-ups can be successful only if all the actors in the scene get the timing right and do their roles well, and Giridharan, Prasanna and Sriram didn’t let down the playwright. Prasanna and Sriram were sprightly, but the day belonged to Giridharan as the compulsive drinker Ramasamy, whose heart is in the right place.
Sreevathson said his play was inspired by one of writer Mari Selvaraj’s articles.
"
Entertainment,"
May 01, 2014 16:47 IST
","
Variety on a platter
","While the villages of Assam were busy preparing for the Bihu festival (which began on April 14), Guwahati and its suburbs were engaged in the evenings by the performing arts festivals that were going on from the last week of March. The prominent one was Uttara Purba Nat Samaroh, from March 31 to April 8, conducted at the Rang Bhawan, Maligaon, Guwahati, by the Sangeet Natak Akademi North East Centre in association with the Asom Natya Sanmilan, which has been working in Assam for the last 53 years for the promotion of diverse theatre.
The festival opened with the Assamese play, ‘
The Lesson,’ by Guwahati-based Rangapeeth and was directed by veteran Dulal Roy, the president of Asom Natya Sanmilan, who played a significant role in building up artistic theatre in Assam.
A translation of Eugene Ionesco’s absurd play ‘La Leçon’ (1950), it ridiculed the known and little known facets in humans through the interactions of a professor and his female student and a maid, who appeared occasionally.
The pressure of studies meaninglessly makes her resort to juvenile behaviour. On the other hand, it meaningfully reflects the amorous sentiments concealed within the aged professor. Naba Baruah and Karabi Pathak in the roles of the Professor and student respectively showed a wonderful onstage chemistry.
The Nepali play ‘
Hum Hi Apna Aap,’ inspired by Dongri writer Padma Sachdev’s Hindi novel, ‘Ab Na Banegi Dehari’, by NSD Sikkim Theatre Training Centre Repertory Company is about the agony of lovers.
Rewati, a widow, falls in love with the god man, Saint Giri Baba. She is prepared to leave everything to live with him but fear of society holds him back. Moreover, to strengthen the blind faith of the village folks in God, the saint has to take Samadhi.
The Bengali play, ‘
Ek Ananter Khoj’ by Natyabhumi, Agartala, written and directed by Sanjoy Kar portrayed well the irreverent attitude of today’s youth, who are not only mobile-facebook-internet savvy but at times into drugs too. The messages of Swami Vivekananda help them to regain a quality life. While the ideology was strong, the drama was less so in this light play that did profile well the talent of young Ankita Saha in the role of Mandira, the protagonist.
Written by Jyotishman Chattopadhyay, the Bengali play ‘
Krishnapurer Rupkatha’ by Nandipat, Kolkata, kept the audience glued to their seats in all aspects, which included the outstanding Kamal Chattopadhyay, who was superb as Gora, a villager. The honest, down-to-earth milkman of Krishnapur, Brindaban Ghosh ( played by Bimal Chakraborty, the director of the play), is transformed into the centre of power and lawbreaker, when he becomes rich by virtue of Goddess Laxmi, who has taken shelter at his home disguised as an old and almost blind woman. The play pointed out that corruption is not an inherent trait of any ‘system,’ but a global phenomenon that is linked to power.
The Hindi play, ‘
Jahajin,’ by Patna based Raaga, also made a strong political statement from a different angle. Written by Rajesh Chandra and directed by Randhir Kumar, it interrogates the concept of development advocated by successive rulers. Does development mean the welfare of the privileged and displacement of the sons of the soil? While putting forth the tribulations of the less fortunate, the presentation made suggestions about mutually supportive developments.
Unfortunately, the Manipuri play ‘
Nagamandalam’ (yes, Girish Karnad’s celebrated play!) translated and directed by Kshetri Jugindro and presented by the Imphal-based Manipuri Ensemble was a catastrophe.
But ‘
Model Vihar’ (Hindi) by Nisarg, Lucknow, on the following day was a compensatory feast. The entire credit goes to the brilliant Lalit Singh Pokhariya, who scripted, directed and handled four roles. The encounters of Sewakji, an acclaimed writer, teacher and intellectual, with city snobs were laced with humour –its hallmark. It was an unforgettable one-man show.
The Nagaon-based Rangalaya’s ‘
Koina Konda Shil’ (Assamese), written and directed by Mrinal Kr Bora, was the festival’s concluding play. The theme was a captivating, five-centuries-old Assamese folktale about the tragedy of a newly wedded royal duo and their entourage.
The strength of the play was primarily in its theme and the rich folk musicals, especially the mellifluous vocal renderings by young Amrita Kaur; nothing noteworthy from the actors.
All the plays essentially banked on dialogue-oriented long narratives rather than the language of the theatre and stage techniques. It also appeared that some of the directors are yet to free themselves from some of the typical NSD clichés. However, with two plays from the hosting state, the Uttara Purba Nat Samaroh successfully highlighted the recent developments, diverse facets and ongoing practices in the artistic theatre of these regions with statements on the aspirations of its people.
"
Entertainment,"
May 01, 2014 14:40 IST
","
Lure of foreign lands
","The basic characteristics of Kewal Dhaliwal’s theatre are the intensity of emotions, imaginative use of draperies to create visual poetry and a scant décor to be in tune with the leitmotif of the play. The acting style he envisages for his actors is marked by a strong motive and vitality to establish an emotional chord with the audience.
These aspects were very much in evidence in his production of “Gaddi Charan Di Kaahal Bari Si” in Punjabi, a part of the Festival of Performing Arts featuring works of the recipients of Akademi awardees organised by the Sangeet Natak Akademi at Abhimanch in New Delhi recently. Remarkable for its focus on the plight of people who attempt to migrate illegally to make it big in foreign countries, the production has overpowering emotional appeal. At another level, it severely indicts the unscrupulous agents who trade in human miseries.
A graduate of National School of Drama and a committed theatre artist, Kewal has immensely contributed to the professional theatre movement in Punjab. He has received the Sangeet Natak Akademi Award 2013 for his contribution to Indian theatre as director.
Kewal has drawn the title of his play from the poetry of Surjit Patar, the renowned Punjabi poet, to symbolise the disillusioned young people in Punjab attempting to go to foreign countries by resorting to illegal means. In most cases, their quest turns out to be a chimera, culminating in eternal hell. With this central theme, Kewal has dramatised four short stories by significant Punjabi writers. To harmonise these different stories into an artistic whole, he has created the character of Sutradhar and between the changes of scenes Patar’s poetry rendered by a chorus to the accompaniment of beats of drum is used which enrich the emotional power of the production.
The play opens with the dramatic version of the short story “Sukh di Ghari” by Baldev Singh Dhinsa. Rotting in a German jail, the victim writes to his father back home, recounting his torturous journey from India to Germany as an illegal immigrant. He is transported from one place to another in a box to avoid being detected by the Police. He recalls the way a goat in his village is kept in a wide open box. His condition was worse than the goat. In this process, he has lost all his dignity and is worse than an animal — just a lifeless object.
The second story enacted is “Pailan Paunda Sap” by Jaswinder Singh. It depicts the shameless manner a husband is forcing his wife to stage a fake marriage ritual with another man to be able to secure her visit to the country in which he is working. Anguished with the conduct of her husband, the woman retaliates. The husband takes pride in adopting a modus operandi to outsmart immigration authorities. He is happy that his wife can leave the country with her fake husband. Through the encounter between, the husband and the wife, the petty mind of the husband and his shameless act is revealed as well as the dilemma of the wife who hates her husband.
Harpreet Sekha’s short story “Ram Gau” deals with the life of a headmaster in a village in Punjab who is respected by the villages and revered by his students. His voice has great weight in the affairs of the village. His family members are settled in Canada. Now that he has retired from service, he is invited by his kith and kin to stay with them in Canada. As soon as the initial excitement of living with his family members subsides, the headmaster is metamorphosed into a stray cow that nobody looks after, everyone shoos him away. Now the headmaster becomes desperate to leave Canada and return to his roots but nobody listens to him. He has lost his freedom, respect and friends; he is a lonely figure, lifeless.
The condition of women among the illegal immigrants are the worst. This heartbreaking reality is reflected in the dramatised version “Galat Aurat” by Veena Verma. The play revolves round an ambitious and beautiful girl who is educated and has dreams of marrying a well-placed and respected young man. Considering a young man working in a foreign country most suitable bridegroom for her daughter, her father marries her off to a Youngman settled abroad. After the marriage is solemnised, he stays for few days with the bride. During this brief period, the girl gets conceived and later gives birth to a male child. The husband leaves her with the promise that he would soon come back with the essential papers and would take her with him. But years have passed and he doesn’t return. Forced by circumstances, the woman leaves India with her son to meet her husband with forged documents. Facing hardships and indignities that are in store for illegal immigrants, she is subjected to rape by different men at difference places. By the time the brute and rapacious agents manage surreptitiously to arrange a meeting between her husband and herself, she is reduced to a miserable wreak. Her husband refuses to recognize her, leaving her in the lurch and be destroyed by wolves in the form of men.
Pavel Sandhu as the prisoner in a jail in Germany; Gurinder Makna as the headmaster migrated to Canada and Mandeep Kaur as the victim of unscrupulous agents desperate to meet her husband, impart to their portraits emotional depth and truly live their characters with riveting performances to grab the attention of the audience.
"
Entertainment,"
May 01, 2014 20:26 IST
","
An ode to creativity and friendship
","Satyajit Ray was recording the background score for Pather Panchali (Song Of The Road) with Pandit Ravi Shankar. The sitar maestro was totally involved in his work when Ray asked him to stop. An astonished Shankar stared at Ray as he asked Shankar to record only as much as required.
Shankar was astonished but never questioned Ray. He did exactly as he was asked too. The result was simply brilliant. The sitar counters during the monsoon rains in Pather Panchali sounded like a flowing rivulet. Restraint was the motto of Ray in every department of filmmaking including music. Shankar understood this very well and his rapport with Ray is legendary.
Way back in the 1940s, Ray saw Neechanagar and Dharti Ke Lal. He was fascinated by Ravi Shankar’s score in both films. The use of the sitar, country drums and flute during the climax of Neechanagar moved him. He made up his mind to work with Shankar if he ever directed a film.
His dream came true with Pather Panchali in 1955. So strong was their association right from their debut film that both worked together again in Aparajito, Apur Sansar and Paras Pathar with resounding success. Shankar read the script of Apu Trilogy a number of times and submitted himself totally to the filmmaker. In Ray, Ravi Shankar discovered a true creator, who understood the language of cinema.
Ray was not the proverbial dictator. His views at work were crystal clear. He never imposed himself on his artists, technicians or composers. Yet he never allowed any of his teammates to go overboard. Be it Ravi Shankar, Vilayat Khan or Ali Akbar Khan, Ray handled them with equal efficiency.
Though Shankar cannot be exactly termed Ray’s musical soul, like Maurice Jarr was of Sir David Lean’s, the Ray-Shankar combination created cinematic wonders acclaimed internationally. The usage of the bamboo flute created emotional waves in Aparajito while the sitar interludes in Paras Pathar had a comic but meaningful touch.
In the late 1950s, Ray decided to shoot a full-length documentary on Ravi Shankar. He prepared the script with the required sketches in his inimitable way. Ray for the first time used water colours for his drawings in the script of this documentary. Sadly, the documentary never went on floors.
Harper Collins, India in association with Satyajit Ray Society is publishing the script in a book form, Ray’s Ravi Shankar that will be released by the iconic actor Naseeruddin Shah at Kolkata on Ray’s birthday today (May 2) as he delivers the Satyajit Ray Memorial Lecture.
The original script and story board are intact making Ray’s Ravi Shankar a delight for readers of all ages. Just as Ravi Shankar was Ray’s, Ray was Ravi Shankar’s to the core.
Ray started composing for his films himself with Teen Kanya (
Three Daughters by Rabindranath Tagore) 1961 onward. Still he maintained his relationship with Shankar till the end of his life. So grieved was Ravi Shankar at Ray’s demise that he composed and created an exclusive album in his memory.
"
Entertainment,"
May 01, 2014 20:17 IST
","
All set for Cannes
","“At the end of the day, I am a film star,” declared Sonam Kapoor. Her declaration came as an endorsement of her favourite look created by L’Oreal Paris for its new L’Or Lumiere collection. The collection was launched by Sonam Kapoor in Mumbai just in time for Cannes Film Festival 2014 this month, where she and the brand’s two other Indian ambassadors — Aishwarya Rai-Bachchan and Freida Pinto — will walk the red carpet.
“The collection focuses on the Indian skin and we should accentuate it,” said Sonam, looking every bit the style diva in a sequined silver flair dress.
Being a star has its own advantages. Like Sonam puts it, the time spent in Cannes will be like a “three-day holiday” that involves representing one’s country and looking beautiful. “When you meet other international actors and models you realise that you are living in a bubble. The world is lot bigger than you think,” she said.
Every year the Raanjhanaa actor makes it a point to take with her to Cannes a bit of Indianness, be it a sari that she wore last year, or jewellery the year before. What’s in the bag this year? “I don’t know. Everyone thinks I plan my look in advance but I don’t. But there will be something Indian this time too.”
"
